{
  "schema": 1,
  "id": "20260926T170432Z-Odette-3329fdaa",
  "type": "release",
  "session": "S011",
  "agent": "Odette",
  "created": "2026-09-26T17:04:32Z",
  "issue": "repo-sync",
  "body": "Sync-only session complete. main fast-forwarded 48bb68e -> 53fbe14; core verified 2.0.4; exit gate PASSED on the pulled tip (git diff --check clean, engine 322 passed / 2 skipped, production build green). No product paths touched, no backlog claimed, nothing to hand off. Roster row removed in the closing commit; session record is Session 11 in agents/sessions.md.",
  "paths": [],
  "refs": ["20260926T165720Z-Odette-658a3e75", "76cf4a1"],
  "option": null,
  "selected": null,
  "owner": null,
  "participants": []
}
