{
  "schema": 1,
  "id": "20260926T081903Z-Rosalind-78d992b8",
  "type": "claim",
  "session": "S008",
  "agent": "Rosalind",
  "created": "2026-09-26T08:19:03Z",
  "issue": "ui-design-pass",
  "body": "Claiming the app's UI surface (`app/renderer`) for a design pass. The supervisor's report, verbatim:\n\"lets work on ui, it feels like it was developed by a backend developer not a real designer\" —\nscoped to \"the entire ui\" when asked in an earlier session (S006).\n\nI looked at the running window rather than the source, on a second isolated Electron instance\n(`--remote-debugging-port=9333`, own `--user-data-dir`, so the supervisor's own window and its\nsidecar were never touched), and captured every surface: welcome, the run view empty and populated\n(maze and files), the config drawer, and the library.\n\n**What I found is not \"no design system\".** `styles.css` carries a documented, deliberate language —\nice = live, amber = belief, red = the world pushed back, green = the world agreed; serif for section\ntitles, mono for everything the engine said; \"an instrument's grammar, not a dashboard's\". The\nwelcome screen and the config drawer are genuinely well-composed. The problem is **composition in the\nrun view**, and it is specific:\n\n1. Empty panes are voids. Three separate centred grey whispers (\"Nothing seen yet\", \"No states yet\",\n   \"No decisions yet\"), each floating in 300-600px of nothing. That is the app's first impression\n   after the welcome, and it reads as broken rather than as invitation.\n2. The map pane's always-on footer (`CELL / COVERAGE / LAST THING IT SAW`) is a raw data dump: 9.5px\n   caps labels over values that do not align with them, three auto-fit columns, and the \"last thing it\n   saw\" sentence wrapping in a narrow column. The single most \"backend developer\" artifact on screen.\n3. Nothing in the run view is larger than 13.5px. All hierarchy is carried by colour, none by scale,\n   so the eye has no focal point anywhere.\n4. Meaning is encoded in unlabelled 9px glyphs — the ledger's two diamonds per row, the confidence\n   meter, the star — decodable only via a legend at the bottom of a different pane.\n5. The command bar clips a world description mid-word and parks it in the toolbar (\"A hidden maze the\n   engine must se…\", \"Every action reads. Paths resolv…\"), duplicating what the config drawer says in\n   full.\n6. The transport shows every confirmed step as a mark, so a 35-step run is a picket fence of ~35\n   identical dashes, and the end-of-run state offers \"jump to end\" and \"rewind to 35\" beside the five\n   transport buttons that already do both.\n\n**One inherited defect I have to resolve to commit anything, and I want it on the record.**\nThe working tree arrived dirty with five renderer files I did not write (`core/decisions.ts`,\n`core/core.test.ts`, `panels/MapPanel.tsx`, `panels/WorldSurface.tsx`, `styles.css`), last modified\n00:40 local, with **no claim, no coordination event, no session entry, and no commit** naming them —\nso I cannot attribute them and I am not going to claim they are mine. They add a `finalAnswerOf()`\nhelper and an answer card for prose worlds, which is a real gap and the right instinct. **They are\nalso red**: `ledger-gates run pre-commit` fails on\n`a stopped run's synthesized answer is unverified` (got `\"12 files\"`, wanted `\"there are 12 files\"`),\nwhich is the classic test-written-first state. The cause is real, not a bad test: a `stopped` event\nthat arrives *inside* an iteration (`decisions.ts` ~line 225) captures `reason` and nothing else, so\n`partial_answer` is dropped on the floor; only the much rarer \"stopped with no fan in front of it\"\npath ever reads it, and that path stuffs it into `evidence`, a field that everywhere else means\n\"what the world said\". I will carry the intent forward and fix it properly (a distinct\n`partialAnswer` / `answerBasis` pair on `Decision`, populated on both paths, `evidence` left meaning\none thing) rather than revert someone's work or commit a red tree.\n\n**Not touching:** `server/appserver/worlds.py`, `server/tests/*`, `ti_matrix/adapters/files_cli.py` —\nthose are Ines's (S007) live `files-root-default` claim and do not overlap this scope.",
  "paths": ["app/renderer"],
  "refs": [],
  "option": null,
  "selected": null,
  "owner": null,
  "participants": []
}
