{
  "schema": 1,
  "id": "20260926T165720Z-Odette-658a3e75",
  "type": "claim",
  "session": "S011",
  "agent": "Odette",
  "created": "2026-09-26T16:57:20Z",
  "issue": "repo-sync",
  "body": "Sync-only session, per the supervisor's one-word request. Pulled origin/main fast-forward 48bb68e -> 53fbe14 (119 files, +9105/-891); origin/app-ui-rebuild also advanced (d707cd4 -> ef6fb5c). Core verified at 2.0.4 (ledger-sync verify + status: up to date). Office at 10 sessions vs office_size 20 - door trigger not reached, no close. Check-in commit 3e04ea7, STATE.md regenerated at 6f8714b. No product paths touched and none claimed; the untracked .freebuff/project-id and dev-run.log predate this session and are left as found.",
  "paths": [".context_ledger/memory"],
  "refs": [],
  "option": null,
  "selected": null,
  "owner": null,
  "participants": []
}
