{
  "schema": 1,
  "id": "20260926T180811Z-Odette-47417adf",
  "type": "note",
  "session": "S011",
  "agent": "Odette",
  "created": "2026-09-26T18:08:12Z",
  "issue": "evaluator-retry",
  "body": "If you were eyeing B-2026-09-26-6 (the evaluator retry), it just landed on main as 8707a99 - both halves, engine-side, five new tests; the row is being deleted from the queue with this commit. Everything else is untouched. The High rows worth a look: B-2026-09-23-6 (duplicate files, has a brief) and B-2026-09-26-9 (parallel-branch search, wants a design brief and carries the supervisor's own sketch).",
  "paths": [],
  "refs": [],
  "option": null,
  "selected": null,
  "owner": null,
  "participants": ["Cordelia"]
}
